interseccion,lat,lon,tipo,hora_matutino,vehiculos_matutino,ciclistas_matutino,peatones_matutino,hora_mediodia,vehiculos_mediodia,ciclistas_mediodia,peatones_mediodia,hora_vespertino,vehiculos_vespertino,ciclistas_vespertino,peatones_vespertino,nivel_servicio_color,nivel_servicio,demora_promedio,icu_maximo,vc_maxima,propuestas,fecha,dibujo_volumen,dibujo_propuesta,nivel_servicio_class
Calzada San Pedro Con Rio Volga,25.65506281,-100.3711067,semaforizada,08:30 - 09:30,1964,3,138,13:00 - 14:00,3028,0,75,17:15 - 18:15,2908,1,96,#7cde0d,B,18,0.477,0.66,"El cruce presenta una operación estable, no requiere cambios en cuanto a su capacidad. Se recomienda rediseñar las esquinas ubicadas al sur y norte del camellón central, esto ayuda a mejorar la visibilidad y reduce la distancia de recorrido del peatón. Es necesario colocar la pintura horizontal tal y como se indica en el dibujo anexo al final de este reporte.",05/12/2019,f94-1,f195-1,A - C
Santa Barbara Con Callejon De Los Ayala,25.66388592,-100.3910848,semaforizada,08:30 - 09:30,1270,1,21,13:30 - 14:30,1534,4,4,18:15 - 19:15,1604,1,12,#ded70d,C,23.7,0.47,0.79,"El cruce presenta una operación estable, no requiere cambios en cuanto a su capacidad. Se recomienda colocar el señalamiento horizontal faltante, tal y como se indica en la figura anexa al final de este reporte.",22/06/2020,f95-1,f196-1,A - C
Santa Barbara Con Callejon De Capellania,25.66539235,-100.3898037,semaforizada,08:30 - 09:30,1018,11,9,13:00 - 14:00,1119,2,2,17:30 - 14:30,1324,7,13,#ded70d,C,31.9,0.499,0.9,"El cruce presenta una operación estable, no requiere cambios en cuanto a su capacidad. Se recomienda colocar el señalamiento horizontal faltante, tal y como se indica en la figura anexa al final de este reporte.",22/06/2020,f96-1,f197-1,A - C
Morones Prieto Con Jimenez ,25.66678005,-100.4082197,semaforizada,08:30 - 09:30,1690,7,99,13:30 - 14:30,1391,0,34,18:30 - 19:30,1880,0,111,#00a806,A,7,0.566,0.56,"El cruce presenta una operación estable, no requiere cambios en cuanto a su capacidad. Se recomienda analizar la opción de retirar el semáforo de este cruce, este opera como rotonda y podría funcionar adecuadamente sin la presencia de un dispositivo semafórico. Con señales de alto, donde para algunos puntos se requiere alto en todos los sentidos, el cruce podría operar con nivel de servicio B, con cortas demoras.",30/06/2020,f97-1,f198-1,A - C
Calzada Del Valle Con Calzada San Pedro,25.6572916,-100.370311,rotonda,08:00 - 09:00,4342,4,183,13:15 - 14:15,4891,4,36,17:45 - 18:45,5998,2,56,#f54242,F,100,1.152,1.62,"La rotonda presenta problemas de capacidad durante su periodo vespertino, con nivel de servicio F y largas filas en la rama oriente, las cuales llegan a bloquear algunas intersecciones a lo largo de la vía. Se recomienda la semaforización de la intersección, tanto para agilizar el flujo de salida como para permitir el cruce de peatones, los cuales deben realizar largos recorridos para pasar de una zona a otra. La semaforización mantiene niveles de servicios, no disminuye demora, sólo reduce la probabilidad de accidentes y la necesidad de oficiales de tránsito durante horarios pico.",06/09/2019,f98-1,f199-1,F
Alfonso Reyes Con Ricardo Margain,25.642237,-100.352639,rotonda,08:30 - 09:30,3237,46,5,13:30 - 14:30,3401,12,3,17:30 - 18:30,3824,80,2,#f54242,F,221.5,1.261,2.19,"La rotonda presenta problemas de capacidad durante su periodo vespertino, con nivel de servicio F y largas filas en la rama sur, con altas demoras para los conductores. Este cruce opera a nivel de saturación y no es factible su ampliación, la semaforización podría ser una opción, sin embargo se tendrían problemas de visibilidad para el sentido poniente-oriente, el cual ingresa al cruce por medio de una curva horizontal muy cercana a la rotonda. El cambio propuesto, anexo al final de este reporte, facilita el cruce peatonal y mejora problemas de seguridad propios del diseño existente.",29/11/2019,f99-1,f200-1,F
Rufino Tamayo Con Frida Kahlo,25.647284,-100.323704,semaforizada,07:30 - 08:30,2614,0,30,13:30 - 14:30,3314,0,35,18:15 - 19:15,2794,1,21,#ded70d,C,29.5,0.834,0.87,"Este cruce presenta una operación estable, no requiere alguna modificación en cuanto a capacidad. Se recomienda mejorar el diseño del señalamiento vial existente, este se encuentra deteriorado o faltan importantes líneas tales como cruces peatonales, líneas de alto o líneas para cambio de carril. El diseño existente es confuso, es necesario el retiro del circulo central y mejora a la carpeta asfáltica.",15/01/2020,f100-1,f201-1,A - C
Roble Con Blvd. Botanica,25.65015003,-100.3573737,semaforizada,08:00 - 09:00,1890,0,53,13:30 - 14:30,1272,0,65,17:45 - 18:45,1161,1,48,#00a806,A,7.7,0.567,0.66,"Este cruce presenta una operación estable, no requiere alguna modificación en cuanto a capacidad. Se recomienda quitar la fase exclusiva para peatones, esta es poco utilizada y aumenta demoras vehiculares.",27/11/2019,f101-1,f202-1,A - C
